{"$schema":"https://json-schema.org/draft/2020-12/schema","$id":"https://github.com/ferfalcon/figma-to-implementation-workflow/schemas/workflow-record.schema.json","title":"Design-to-Implementation Workflow Record","description":"Canonical schema-v2 control record for workflow state, toolkit identity, gates, source verification, artifacts, traceability, tasks, profile transitions, validation, and final review.","type":"object","additionalProperties":false,"required":["schemaVersion","project","state","snapshots","verifications","artifacts","traceItems","gates","tasks","profileTransitions","implementationReviews"],"properties":{"schemaVersion":{"const":2},"project":{"type":"object","additionalProperties":false,"required":["name","profile","executionMode"],"properties":{"name":{"type":"string","minLength":1},"profile":{"enum":["Express","Lite","Standard","Full"]},"executionMode":{"enum":["Gated","Continuous documentation","Task-by-task"]}}},"toolkit":{"type":"object","additionalProperties":false,"required":["repository","revision"],"properties":{"repository":{"type":"string","pattern":"^[A-Za-z0-9_.-]+/[A-Za-z0-9_.-]+$"},"revision":{"type":"string","pattern":"^[0-9a-f]{40}$"}}},"state":{"type":"object","additionalProperties":false,"required":["stage","status","activeInputs","currentTask","latestOutput","latestValidationRuntime","architectureDecision"],"properties":{"stage":{"type":"integer","minimum":0,"maximum":11},"status":{"enum":["Not started","In progress","Ready","Blocked","Complete"]},"activeInputs":{"type":"array","items":{"$ref":"#/$defs/snapshotId"},"uniqueItems":true},"currentTask":{"anyOf":[{"$ref":"#/$defs/taskId"},{"type":"null"}]},"latestOutput":{"anyOf":[{"$ref":"#/$defs/repositorySnapshotId"},{"type":"null"}]},"latestValidationRuntime":{"anyOf":[{"$ref":"#/$defs/runtimeSnapshotId"},{"type":"null"}]},"architectureDecision":{"anyOf":[{"type":"object","additionalProperties":false,"required":["result","reason","recordedAt"],"properties":{"result":{"enum":["Required","Not required"]},"reason":{"type":"string","minLength":1},"recordedAt":{"type":"string","format":"date-time"}}},{"type":"null"}]}}},"snapshots":{"type":"array","items":{"type":"object","additionalProperties":false,"required":["id","role","pinStrength","status","reference"],"properties":{"id":{"$ref":"#/$defs/snapshotId"},"role":{"enum":["Input baseline","Supporting source","Task start","Implementation output","Validation runtime","Historical reference"]},"pinStrength":{"enum":["Immutable","Versioned","Time-bound","Unverified"]},"status":{"enum":["Active","Superseded","Invalid","Unverified"]},"reference":{"type":"string","minLength":1},"commit":{"type":"string","pattern":"^[0-9a-f]{40}$"},"parent":{"$ref":"#/$defs/repositorySnapshotId"},"task":{"$ref":"#/$defs/taskId"},"supersededBy":{"$ref":"#/$defs/snapshotId"}}}},"verifications":{"type":"array","items":{"type":"object","additionalProperties":false,"required":["id","snapshot","result","method","evidence","checkedAt"],"properties":{"id":{"$ref":"#/$defs/verificationId"},"snapshot":{"$ref":"#/$defs/snapshotId"},"result":{"enum":["Unchanged","Expected workflow output","Unexpected upstream or concurrent change","Unavailable"]},"method":{"type":"string","minLength":1},"evidence":{"type":"string","minLength":1},"checkedAt":{"type":"string","format":"date-time"},"replacement":{"$ref":"#/$defs/snapshotId"}}}},"artifacts":{"type":"array","items":{"type":"object","additionalProperties":false,"required":["id","type","path","status","baseline"],"properties":{"id":{"$ref":"#/$defs/artifactId"},"type":{"enum":["SOURCE-BASELINE","PROJECT-CONTEXT","WORKFLOW-STATE","DESIGN-AUDIT","WORKPACK","IMPLEMENTATION-BRIEF","REQUIREMENTS","DESIGN","SPEC","DOCUMENT-REVIEW","ARCHITECTURE","PLAN","PLAN-REVIEW","TASKS-INDEX","TASK","IMPLEMENTATION-REVIEW"]},"path":{"type":"string","minLength":1},"status":{"enum":["Draft","Reviewed","Approved","Superseded"]},"baseline":{"type":"array","items":{"$ref":"#/$defs/snapshotId"},"uniqueItems":true},"statusChangedAt":{"type":"string","format":"date-time"},"statusEvidence":{"type":"string","minLength":1},"statusBy":{"type":"string","minLength":1},"approvedRevision":{"$ref":"#/$defs/contentRevision"},"supersededBy":{"$ref":"#/$defs/artifactId"}}}},"traceItems":{"type":"array","items":{"type":"object","additionalProperties":false,"required":["id","owner","status","required","references"],"properties":{"id":{"$ref":"#/$defs/domainId"},"owner":{"$ref":"#/$defs/artifactId"},"status":{"enum":["Active","Superseded"]},"required":{"type":"boolean"},"references":{"type":"array","items":{"$ref":"#/$defs/domainId"},"uniqueItems":true},"supersededBy":{"$ref":"#/$defs/domainId"}}}},"gates":{"type":"array","items":{"type":"object","additionalProperties":false,"required":["id","stage","status","result","baseline","verifications","artifacts","evidence","recordedAt"],"properties":{"id":{"$ref":"#/$defs/gateId"},"stage":{"type":"integer","minimum":0,"maximum":11},"status":{"enum":["Active","Superseded"]},"result":{"enum":["Passed","Passed with assumptions","Blocked","Must upgrade"]},"baseline":{"type":"array","items":{"$ref":"#/$defs/snapshotId"},"uniqueItems":true},"verifications":{"type":"array","items":{"$ref":"#/$defs/verificationId"},"uniqueItems":true},"artifacts":{"type":"array","items":{"$ref":"#/$defs/artifactId"},"uniqueItems":true},"artifactRevisions":{"type":"array","items":{"type":"object","additionalProperties":false,"required":["artifact","revision"],"properties":{"artifact":{"$ref":"#/$defs/artifactId"},"revision":{"$ref":"#/$defs/contentRevision"}}}},"evidence":{"type":"string","minLength":1},"recordedAt":{"type":"string","format":"date-time"},"approvedBy":{"type":"string","minLength":1}}}},"tasks":{"type":"array","items":{"type":"object","additionalProperties":false,"required":["id","status","baseline","prerequisites","references","output","blocker","validation"],"properties":{"id":{"$ref":"#/$defs/taskId"},"status":{"enum":["Not started","Ready","In progress","Blocked","Complete"]},"baseline":{"$ref":"#/$defs/repositorySnapshotId"},"prerequisites":{"type":"array","items":{"$ref":"#/$defs/taskId"},"uniqueItems":true},"references":{"type":"array","items":{"$ref":"#/$defs/domainId"},"uniqueItems":true},"output":{"anyOf":[{"$ref":"#/$defs/repositorySnapshotId"},{"type":"null"}]},"blocker":{"anyOf":[{"type":"object","additionalProperties":false,"required":["reason","previousStatus","recordedAt"],"properties":{"reason":{"type":"string","minLength":1},"previousStatus":{"enum":["Not started","Ready","In progress"]},"recordedAt":{"type":"string","format":"date-time"}}},{"type":"null"}]},"validation":{"type":"array","items":{"type":"object","additionalProperties":false,"required":["name","kind","required","status","expected","evidence","references"],"properties":{"name":{"type":"string","minLength":1},"kind":{"enum":["Build","Test","Accessibility","Responsive","Visual","Security","Performance","Manual","Other"]},"required":{"type":"boolean"},"status":{"enum":["Passed","Failed","Blocked","Not executed","Not applicable"]},"expected":{"type":"string","minLength":1},"actual":{"type":"string","minLength":1},"command":{"type":"string","minLength":1},"environment":{"type":"string","minLength":1},"executedAt":{"type":"string","format":"date-time"},"subject":{"$ref":"#/$defs/validationSubject"},"evidence":{"type":"array","items":{"type":"string","minLength":1},"uniqueItems":true},"reason":{"type":"string","minLength":1},"references":{"type":"array","items":{"$ref":"#/$defs/domainId"},"uniqueItems":true}}}}}}},"profileTransitions":{"type":"array","items":{"type":"object","additionalProperties":false,"required":["id","from","to","resumeStage","reason","status","sourceArtifacts","targetArtifacts","startedAt"],"properties":{"id":{"$ref":"#/$defs/profileTransitionId"},"from":{"enum":["Express","Lite","Standard","Full"]},"to":{"enum":["Express","Lite","Standard","Full"]},"resumeStage":{"type":"integer","minimum":0,"maximum":11},"reason":{"type":"string","minLength":1},"status":{"enum":["In progress","Complete"]},"sourceArtifacts":{"type":"array","items":{"$ref":"#/$defs/artifactId"},"uniqueItems":true},"targetArtifacts":{"type":"array","items":{"$ref":"#/$defs/artifactId"},"uniqueItems":true},"startedAt":{"type":"string","format":"date-time"},"completedAt":{"type":"string","format":"date-time"},"evidence":{"type":"string","minLength":1},"approvedBy":{"type":"string","minLength":1}}}},"implementationReviews":{"type":"array","items":{"type":"object","additionalProperties":false,"required":["id","status","result","artifact","output","evidence","recordedAt","approvedBy","deviations"],"properties":{"id":{"$ref":"#/$defs/reviewId"},"status":{"enum":["Active","Superseded"]},"result":{"enum":["accepted","accepted-with-deviations","requires-corrections"]},"artifact":{"$ref":"#/$defs/artifactId"},"artifactRevision":{"$ref":"#/$defs/contentRevision"},"output":{"$ref":"#/$defs/repositorySnapshotId"},"runtime":{"$ref":"#/$defs/runtimeSnapshotId"},"evidence":{"type":"string","minLength":1},"recordedAt":{"type":"string","format":"date-time"},"approvedBy":{"type":"string","minLength":1},"deviations":{"type":"array","items":{"type":"string","minLength":1},"uniqueItems":true}}}},"legacyBoundary":{"type":"object","additionalProperties":false,"required":["migratedFrom","gatesRequiredFromStage","traceRequiredFromStage"],"properties":{"migratedFrom":{"const":1},"gatesRequiredFromStage":{"type":"integer","minimum":0,"maximum":11},"traceRequiredFromStage":{"type":"integer","minimum":0,"maximum":11}}}},"$defs":{"snapshotId":{"type":"string","pattern":"^SRC-(DS|REPO|RUN|DOC|ASSET)-[0-9]{3,}$"},"repositorySnapshotId":{"type":"string","pattern":"^SRC-REPO-[0-9]{3,}$"},"runtimeSnapshotId":{"type":"string","pattern":"^SRC-RUN-[0-9]{3,}$"},"taskId":{"type":"string","pattern":"^P[0-9]{2}-T[0-9]{2}$"},"artifactId":{"type":"string","pattern":"^ART-[A-Z0-9-]+$"},"verificationId":{"type":"string","pattern":"^VER-[0-9]{3,}$"},"gateId":{"type":"string","pattern":"^GATE-[0-9]{3,}$"},"profileTransitionId":{"type":"string","pattern":"^PROFILE-[0-9]{3,}$"},"reviewId":{"type":"string","pattern":"^REVIEW-[0-9]{3,}$"},"domainId":{"type":"string","pattern":"^(EVD|AUD|AC|ADR|PLAN|DOC|PLANREV|IMPL)-[0-9]{3,}$|^REQ-(FR|BR|DR|NFR|AR|SEC|CON)-[0-9]{3,}$|^DES(-RWD|-INT)?-[0-9]{3,}$|^SPEC-(BEH|INT|VAL|ACC|DATA)-[0-9]{3,}$"},"contentRevision":{"type":"object","additionalProperties":false,"required":["algorithm","digest"],"properties":{"algorithm":{"const":"sha256"},"digest":{"type":"string","pattern":"^[0-9a-f]{64}$"}}},"validationSubject":{"type":"object","additionalProperties":false,"required":["commit"],"properties":{"commit":{"type":"string","pattern":"^[0-9a-f]{40}$"},"runtime":{"$ref":"#/$defs/runtimeSnapshotId"}}}}}
